{"familyId":"CAL-STONEWOOD-V1","geometry":{"lintelHeightMm":250,"moduleHeightMm":3000,"moduleWidthMm":4000,"mortarGapMm":20,"openingHeightMm":2000,"openingWidthMm":1600,"stoneCourseHeightMm":250,"stoneDepthJitterMm":30,"stoneLengthJitterMm":40,"stoneOffsetJitterMm":20,"timberDepthMm":160,"timberWidthMm":180,"wallThicknessMm":400},"materials":{"stoneBaseColorSrgb8":[96,92,82],"stoneMetallicPermille":0,"stoneRoughnessPermille":850,"woodBaseColorSrgb8":[92,58,32],"woodMetallicPermille":0,"woodRoughnessPermille":720},"profile":"calibration-v1","schemaVersion":1,"seed":1592594996}
